{
  "asset_name": "wuyun-liuqi-rag-index",
  "asset_type": "knowledge_base_index",
  "description": "五运六气 RAG 知识库资产索引。用于说明各 asset 的用途、检索键和维护状态。",
  "total_entries": 32,
  "primary_api": "scripts/calculate_yunqi_api.py",
  "entries": [
    {
      "entry_id": "rag_index_asset1_suiyun",
      "entry_type": "asset_index",
      "title": "岁运病机资产",
      "file": "asset1_suiyun.json",
      "asset_id": "asset1_suiyun",
      "asset_name": "岁运病机数据库",
      "asset_category": "suiyun_pathogenesis",
      "description": "五运太过不及之病机、症状、治则、饮食调理。基于《素问·气交变大论》《素问·五常政大论》。",
      "total_entries": 10,
      "lookup_fields": [
        "code"
      ],
      "example_keys": [
        "wood_excess",
        "wood_deficient",
        "fire_excess"
      ],
      "rag_key": "asset1_suiyun"
    },
    {
      "entry_id": "rag_index_asset2_sitian_zaiquan",
      "entry_type": "asset_index",
      "title": "司天在泉资产",
      "file": "asset2_sitian_zaiquan.json",
      "asset_id": "asset2_sitian_zaiquan",
      "asset_name": "司天在泉病机数据库",
      "asset_category": "sitian_zaiquan_pathogenesis",
      "description": "六气司天在泉之病机、症状、治法。每年司天主上半年，在泉主下半年，共6组司天在泉配对，涵盖12个半年节段。基于《素问·至真要大论》。",
      "total_entries": 6,
      "lookup_fields": [
        "sitian_key",
        "zaiquan_key",
        "rag_key"
      ],
      "example_keys": [
        "jueyin_fengmu_sitian",
        "shaoyang_xianghuo_zaiquan",
        "shaoyin_junhuo_sitian"
      ],
      "rag_key": "asset2_sitian_zaiquan"
    },
    {
      "entry_id": "rag_index_asset3_kezhujialin",
      "entry_type": "asset_index",
      "title": "客主加临资产",
      "file": "asset3_kezhujialin.json",
      "asset_id": "asset3_kezhujialin",
      "asset_name": "客主加临病机库",
      "asset_category": "kezhujialin_pathogenesis",
      "description": "六气客主加临之顺逆、病机、临床关注重点。主气六步固定不变，客气逐年流转，6主气×6客气=36种组合。基于《素问·五运行大论》《素问·至真要大论》客主加临理论。",
      "total_entries": 36,
      "lookup_fields": [
        "key",
        "rag_key"
      ],
      "example_keys": [
        "zhu_jueyin_ke_jueyin",
        "zhu_jueyin_ke_shaoyin",
        "zhu_jueyin_ke_taiyin"
      ],
      "rag_key": "asset3_kezhujialin"
    },
    {
      "entry_id": "rag_index_asset4_formula",
      "entry_type": "asset_index",
      "title": "运气方资产",
      "file": "asset4_formula.json",
      "asset_id": "asset4_formula",
      "asset_name": "三因司天方 — 运气方剂数据库",
      "asset_category": "yunqi_formula",
      "description": "陈无择《三因极一病证方论》运气时气方，包含五运时气方10首和六气时气方6首。每方对应特定运气格局，为运气辨证论治提供方药参考。（v2：蒸馏公版原文，补六步时令加减、六气病机推演，订正审平汤/升明汤组成）",
      "total_entries": 16,
      "lookup_fields": [
        "rag_key"
      ],
      "example_keys": [
        "wood_excess",
        "fire_excess",
        "earth_excess"
      ],
      "rag_key": "asset4_formula"
    },
    {
      "entry_id": "rag_index_asset5_commentary",
      "entry_type": "asset_index",
      "title": "历代注家资产",
      "file": "asset5_commentary.json",
      "asset_id": "asset5_commentary",
      "asset_name": "历代注家运气学说数据库",
      "asset_category": "commentary",
      "description": "唐代至清代主要医家对五运六气学说的核心贡献与独特见解，涵盖王冰、刘完素、张元素、李东垣、汪石山、张景岳、吴谦、缪问、徐灵胎、张志聪、陆懋修等。每条目包含医家简介、核心理论、经典原文、临床意义。",
      "total_entries": 30,
      "lookup_fields": [
        "related_yunqi_keys",
        "commentary_id"
      ],
      "example_keys": [
        "tiangan_wuyun",
        "dizhi_liuqi",
        "sitian_zaiquan"
      ],
      "rag_key": "asset5_commentary"
    },
    {
      "entry_id": "rag_index_asset6_regional",
      "entry_type": "asset_index",
      "title": "地域修正资产",
      "file": "asset6_regional.json",
      "asset_id": "asset6_regional",
      "asset_name": "地域运气修正数据库",
      "asset_category": "regional_modifier",
      "description": "中国不同地理区域的运气推算修正系数。同一运气格局在不同地区的实际气候表现差异显著，本库提供纬度、海拔、地貌等因素的修正参考。",
      "total_entries": 8,
      "lookup_fields": [
        "region_id",
        "region_name"
      ],
      "example_keys": [
        "regional_1",
        "东北地区（黑吉辽）",
        "regional_2"
      ],
      "rag_key": "asset6_regional"
    },
    {
      "entry_id": "rag_index_asset7_constitution",
      "entry_type": "asset_index",
      "title": "运气体质资产",
      "file": "asset7_constitution.json",
      "asset_id": "asset7_constitution",
      "asset_name": "运气与体质交叉分析数据库",
      "asset_category": "constitution_alignment",
      "description": "九种体质（王琦九分法）与五运六气格局的匹配关系。不同出生年运气格局影响先天体质倾向，不同运气岁气背景下各体质的发病倾向与调理要点。",
      "total_entries": 108,
      "lookup_fields": [
        "birth_yunqi_keys",
        "suiyun_code",
        "constitution_code"
      ],
      "example_keys": [
        "earth_deficient",
        "metal_excess",
        "qi_xu"
      ],
      "rag_key": "asset7_constitution"
    },
    {
      "entry_id": "rag_index_asset9_cases",
      "entry_type": "asset_index",
      "title": "圣济总录六十甲子岁图医案库",
      "file": "asset9_cases.json",
      "asset_id": "asset9_cases",
      "asset_name": "圣济总录六十甲子岁图医案库",
      "asset_category": "yunqi_cases",
      "description": "宋《圣济总录》运气门六十甲子岁图蒸馏的逐年运气医案。每条含岁运/司天在泉/rag_keys/六步客气病机与治法/年病机/年治法/原文摘录。可按 rag_key 检索同类格局医案。",
      "total_entries": 60,
      "lookup_fields": [
        "code",
        "rag_key",
        "sitian_key",
        "zaiquan_key"
      ],
      "example_keys": [
        "earth_excess",
        "shaoyin_junhuo_sitian",
        "yangming_zaojin_zaiquan"
      ],
      "rag_key": "asset9_cases"
    },
    {
      "entry_id": "rag_index_asset10_suiyi_zhifa",
      "entry_type": "asset_index",
      "title": "六气岁宜治法库",
      "file": "asset10_suiyi_zhifa.json",
      "asset_id": "asset10_suiyi_zhifa",
      "asset_name": "六气岁宜治法库",
      "asset_category": "suiyi_zhifa",
      "description": "金·刘完素《素问病机气宜保命集·气宜论》录《内经》六气司天之政岁宜治法。六气司天各一条，为三因司天方背后的治则原文依据。仅作运气学理论参考，具体诊疗须遵医嘱。",
      "total_entries": 6,
      "lookup_fields": [
        "sitian_key"
      ],
      "example_keys": [
        "taiyang_hanshui_sitian",
        "yangming_zaojin_sitian",
        "shaoyang_xianghuo_sitian"
      ],
      "rag_key": "asset10_suiyi_zhifa"
    },
    {
      "entry_id": "rag_index_asset11_mingyi_cases",
      "entry_type": "asset_index",
      "title": "名医类案 — 病证分类真实医案库",
      "file": "asset11_mingyi_cases.json",
      "asset_id": "asset11_mingyi_cases",
      "asset_name": "名医类案 — 病证分类真实医案库",
      "asset_category": "case_library",
      "description": "明·江瓘《名医类案》公版蒸馏的真实医案库，按病证分类（中风/虚风/伤风/伤寒等）。每条含病证/医家/主诉/辨证/治法/方药/疗效/原文摘录。是 asset9（岁图医案，按格局检索）的补充——asset11 按病证检索，覆盖真实历史医案。",
      "total_entries": 102,
      "lookup_fields": [
        "rag_key",
        "entry_id"
      ],
      "example_keys": [
        "中风",
        "mingyi_001",
        "mingyi_002"
      ],
      "rag_key": "asset11_mingyi_cases"
    },
    {
      "entry_id": "rag_index_asset12_xumingyi_cases",
      "entry_type": "asset_index",
      "title": "续名医类案 — 病证分类真实医案库（续）",
      "file": "asset12_xumingyi_cases.json",
      "asset_id": "asset12_xumingyi_cases",
      "asset_name": "续名医类案 — 病证分类真实医案库（续）",
      "asset_category": "case_library",
      "description": "清·魏之琇《续名医类案》公版蒸馏的真实医案库，按病证分类。魏之琇补《名医类案》之作，医案更详（万全/缪仲淳/许叔微/张子和等）。与 asset11（名医类案）同格式，按病证检索。",
      "total_entries": 84,
      "lookup_fields": [
        "rag_key",
        "entry_id"
      ],
      "example_keys": [
        "伤寒",
        "xumingyi_001",
        "xumingyi_002"
      ],
      "rag_key": "asset12_xumingyi_cases"
    },
    {
      "entry_id": "rag_index_asset13_gujin_an_cases",
      "entry_type": "asset_index",
      "title": "古今医案按 — 病证分类真实医案库（俞震精选）",
      "file": "asset13_gujin_an_cases.json",
      "asset_id": "asset13_gujin_an_cases",
      "asset_name": "古今医案按 — 病证分类真实医案库（俞震精选）",
      "asset_category": "case_library",
      "description": "清·俞震《古今医案按》公版蒸馏的真实医案库。俞震精选历代医案并加'震按'评语，点评医家辨证思路，是医案按语类最高质量代表。按病证分类，与 asset11/12 同格式。",
      "total_entries": 159,
      "lookup_fields": [
        "rag_key",
        "entry_id"
      ],
      "example_keys": [
        "中风",
        "gujin_001",
        "gujin_002"
      ],
      "rag_key": "asset13_gujin_an_cases"
    },
    {
      "entry_id": "rag_index_asset14_dingganren_cases",
      "entry_type": "asset_index",
      "title": "丁甘仁医案 — 病证分类真实医案库（孟河医派）",
      "file": "asset14_dingganren_cases.json",
      "asset_id": "asset14_dingganren_cases",
      "asset_name": "丁甘仁医案 — 病证分类真实医案库（孟河医派）",
      "asset_category": "case_library",
      "description": "民国·丁甘仁《丁甘仁医案》公版蒸馏的真实医案库。丁甘仁为孟河医派代表，医案辨证精详，每条带病机+治法+方药+多诊随访，最贴近现代临床。与 asset11/12/13 同格式，按病证检索。",
      "total_entries": 177,
      "lookup_fields": [
        "rag_key",
        "entry_id"
      ],
      "example_keys": [
        "伤寒",
        "dingganren_001",
        "dingganren_002"
      ],
      "rag_key": "asset14_dingganren_cases"
    },
    {
      "entry_id": "rag_index_asset16_ye_cases",
      "entry_type": "asset_index",
      "title": "临证指南医案 — 病证分类真实医案库（叶桂）",
      "file": "asset16_ye_cases.json",
      "asset_id": "asset16_ye_cases",
      "asset_name": "临证指南医案 — 病证分类真实医案库（叶桂）",
      "asset_category": "case_library",
      "description": "清·叶桂《临证指南医案》公版蒸馏的真实医案库。叶天士，清代温病大家，医案以'识病之巧、立方之简'著称，每案精审病机（华岫云按语总括治法）。按病证分类，与 asset11-15 同格式。",
      "total_entries": 330,
      "lookup_fields": [
        "rag_key",
        "entry_id"
      ],
      "example_keys": [
        "肝风",
        "ye_001",
        "ye_002"
      ],
      "rag_key": "asset16_ye_cases"
    },
    {
      "entry_id": "rag_index_asset17_wenyi_yunqi",
      "entry_type": "asset_index",
      "title": "运气瘟疫防治资产",
      "file": "asset17_wenyi_yunqi.json",
      "asset_id": "asset17_wenyi_yunqi",
      "asset_name": "松峰说疫·运气瘟疫防治库",
      "asset_category": "wenyi_yunqi",
      "description": "清·刘奎《松峰说疫》卷六运气专篇蒸馏。将运气格局与瘟疫防治对接：五运太过不及之瘟疫侧重、六气司天在泉之民病预警、五郁治法（郁之发/夺/泄/折/达/发）、以及刚柔失守对应疫病之专属防治方（五瘟丹等）。是现有病机资产未覆盖的『运气—疫病—防治专方』维度。",
      "total_entries": 34,
      "lookup_fields": [
        "code",
        "sitian_key",
        "zaiquan_key",
        "rag_key",
        "ganzhi",
        "category"
      ],
      "example_keys": [
        "earth_excess",
        "甲",
        "五运太过"
      ],